{
  "generated_at": "2026-08-04",
  "dataset_name": "Axiom Atlas Seed Fixture",
  "dataset_version": "0.1.0",
  "nodes": [
    {
      "id": "software:sagemath",
      "type": "software",
      "title": "SageMath",
      "summary": "Open-source mathematics software system spanning algebra, geometry, number theory, cryptography, and numerics.",
      "url": "https://www.sagemath.org",
      "tags": ["python", "computer algebra", "symbolic algebra", "number theory"],
      "metadata": {
        "languages": ["Python", "Cython"],
        "license": "GPL-3.0-or-later",
        "status": "active",
        "msc_codes": ["11-04", "68W30"],
        "algorithms": ["algorithm:groebner", "algorithm:modular-arithmetic"],
        "community_id": "community:computational-algebra",
        "repository": "repository:sagemath"
      },
      "provenance": {
        "source": "local_fixture",
        "evidence": "Seed fixture aligned to production schema for Phase 1 development",
        "confidence": 1.0,
        "retrieved_at": "2026-08-04"
      }
    },
    {
      "id": "software:singular",
      "type": "software",
      "title": "Singular",
      "summary": "Computer algebra system focused on polynomial computations, singularity theory, and algebraic geometry.",
      "url": "https://www.singular.uni-kl.de",
      "tags": ["c++", "algebraic geometry", "groebner bases"],
      "metadata": {
        "languages": ["C++"],
        "license": "GPL-2.0-or-later",
        "status": "active",
        "msc_codes": ["13P10", "14Q99"],
        "algorithms": ["algorithm:groebner"],
        "community_id": "community:computational-algebra",
        "repository": "repository:singular"
      },
      "provenance": {
        "source": "local_fixture",
        "evidence": "Seed fixture aligned to production schema for Phase 1 development",
        "confidence": 1.0,
        "retrieved_at": "2026-08-04"
      }
    },
    {
      "id": "software:macaulay2",
      "type": "software",
      "title": "Macaulay2",
      "summary": "Research software system supporting computations in algebraic geometry and commutative algebra.",
      "url": "https://macaulay2.com",
      "tags": ["commutative algebra", "algebraic geometry"],
      "metadata": {
        "languages": ["C++", "M2"],
        "license": "GPL-2.0-or-later",
        "status": "active",
        "msc_codes": ["13-04", "14Q99"],
        "algorithms": ["algorithm:groebner", "algorithm:hilbert-series"],
        "community_id": "community:computational-algebra",
        "repository": "repository:macaulay2"
      },
      "provenance": {
        "source": "local_fixture",
        "evidence": "Seed fixture aligned to production schema for Phase 1 development",
        "confidence": 1.0,
        "retrieved_at": "2026-08-04"
      }
    },
    {
      "id": "software:fenics",
      "type": "software",
      "title": "FEniCS",
      "summary": "Open-source computing platform for solving partial differential equations using the finite element method.",
      "url": "https://fenicsproject.org",
      "tags": ["finite elements", "python", "pdes"],
      "metadata": {
        "languages": ["Python", "C++"],
        "license": "LGPL-3.0-or-later",
        "status": "active",
        "msc_codes": ["65N30", "65Y05"],
        "algorithms": ["algorithm:finite-element"],
        "community_id": "community:scientific-computing",
        "repository": "repository:fenics"
      },
      "provenance": {
        "source": "local_fixture",
        "evidence": "Seed fixture aligned to production schema for Phase 1 development",
        "confidence": 1.0,
        "retrieved_at": "2026-08-04"
      }
    },
    {
      "id": "software:homotopycontinuationjl",
      "type": "software",
      "title": "HomotopyContinuation.jl",
      "summary": "Julia package for numerical algebraic geometry and homotopy continuation methods.",
      "url": "https://www.juliahomotopycontinuation.org",
      "tags": ["julia", "numerical algebraic geometry", "homotopy continuation"],
      "metadata": {
        "languages": ["Julia"],
        "license": "MIT",
        "status": "active",
        "msc_codes": ["65H10", "14Q99"],
        "algorithms": ["algorithm:homotopy-continuation"],
        "community_id": "community:numerical-algebraic-geometry",
        "repository": "repository:homotopycontinuationjl"
      },
      "provenance": {
        "source": "local_fixture",
        "evidence": "Seed fixture aligned to production schema for Phase 1 development",
        "confidence": 1.0,
        "retrieved_at": "2026-08-04"
      }
    },
    {
      "id": "paper:groebner-survey",
      "type": "paper",
      "title": "Software Ecosystems for Groebner Basis Computation",
      "summary": "Survey of research software systems used for Groebner basis workflows.",
      "url": "https://example.org/papers/groebner-survey",
      "tags": ["groebner bases", "software survey"],
      "metadata": {
        "year": 2024,
        "msc_codes": ["13P10", "68W30"],
        "software": ["software:sagemath", "software:singular", "software:macaulay2"],
        "community_id": "community:computational-algebra"
      },
      "provenance": {
        "source": "local_fixture",
        "evidence": "Seed fixture aligned to production schema for Phase 1 development",
        "confidence": 1.0,
        "retrieved_at": "2026-08-04"
      }
    },
    {
      "id": "paper:fenics-pdes",
      "type": "paper",
      "title": "Reproducible Finite Element Pipelines with FEniCS",
      "summary": "Study describing reproducible PDE workflows using FEniCS.",
      "url": "https://example.org/papers/fenics-pdes",
      "tags": ["finite element", "reproducibility"],
      "metadata": {
        "year": 2023,
        "msc_codes": ["65N30", "65Y05"],
        "software": ["software:fenics"],
        "community_id": "community:scientific-computing"
      },
      "provenance": {
        "source": "local_fixture",
        "evidence": "Seed fixture aligned to production schema for Phase 1 development",
        "confidence": 1.0,
        "retrieved_at": "2026-08-04"
      }
    },
    {
      "id": "paper:homotopy-landscape",
      "type": "paper",
      "title": "Modern Software for Numerical Algebraic Geometry",
      "summary": "Overview of software and community patterns around homotopy continuation.",
      "url": "https://example.org/papers/homotopy-landscape",
      "tags": ["numerical algebraic geometry", "julia"],
      "metadata": {
        "year": 2025,
        "msc_codes": ["65H10", "14Q99"],
        "software": ["software:homotopycontinuationjl"],
        "community_id": "community:numerical-algebraic-geometry"
      },
      "provenance": {
        "source": "local_fixture",
        "evidence": "Seed fixture aligned to production schema for Phase 1 development",
        "confidence": 1.0,
        "retrieved_at": "2026-08-04"
      }
    },
    {
      "id": "algorithm:groebner",
      "type": "algorithm",
      "title": "Groebner Basis Computation",
      "summary": "Algorithms for transforming polynomial ideals into a canonical basis useful for elimination and solving systems.",
      "url": "https://example.org/algorithms/groebner",
      "tags": ["computer algebra"],
      "metadata": {
        "domain": "Computational algebra",
        "software": ["software:sagemath", "software:singular", "software:macaulay2"]
      },
      "provenance": {
        "source": "local_fixture",
        "evidence": "Seed fixture aligned to production schema for Phase 1 development",
        "confidence": 1.0,
        "retrieved_at": "2026-08-04"
      }
    },
    {
      "id": "algorithm:finite-element",
      "type": "algorithm",
      "title": "Finite Element Method",
      "summary": "Discretization method for approximating PDE solutions over meshes.",
      "url": "https://example.org/algorithms/finite-element",
      "tags": ["numerics"],
      "metadata": {
        "domain": "Scientific computing",
        "software": ["software:fenics"]
      },
      "provenance": {
        "source": "local_fixture",
        "evidence": "Seed fixture aligned to production schema for Phase 1 development",
        "confidence": 1.0,
        "retrieved_at": "2026-08-04"
      }
    },
    {
      "id": "algorithm:homotopy-continuation",
      "type": "algorithm",
      "title": "Homotopy Continuation",
      "summary": "Numerical path-tracking family of methods for solving polynomial systems.",
      "url": "https://example.org/algorithms/homotopy-continuation",
      "tags": ["numerical algebraic geometry"],
      "metadata": {
        "domain": "Numerical algebraic geometry",
        "software": ["software:homotopycontinuationjl"]
      },
      "provenance": {
        "source": "local_fixture",
        "evidence": "Seed fixture aligned to production schema for Phase 1 development",
        "confidence": 1.0,
        "retrieved_at": "2026-08-04"
      }
    },
    {
      "id": "community:computational-algebra",
      "type": "community",
      "title": "Computational Algebra",
      "summary": "Community centered on symbolic computation, polynomial systems, and algebraic geometry software.",
      "url": "https://example.org/communities/computational-algebra",
      "tags": ["groebner bases", "symbolic computation"],
      "metadata": {
        "dominant_msc_codes": ["13P10", "14Q99", "68W30"],
        "representative_software": ["software:sagemath", "software:singular", "software:macaulay2"]
      },
      "provenance": {
        "source": "local_fixture",
        "evidence": "Seed fixture aligned to production schema for Phase 1 development",
        "confidence": 1.0,
        "retrieved_at": "2026-08-04"
      }
    },
    {
      "id": "community:scientific-computing",
      "type": "community",
      "title": "Scientific Computing",
      "summary": "Community focused on numerical methods, PDE simulation, and reproducible computational workflows.",